{"artifact_source":"same-scenario-fallback","case_id":"trace-b","claim_boundary":"SIMULATED TEACHING DATA / NOT LIVE / NOT MEASURED / NOT CANONICAL-PARITY-VERIFIED","energy_breakdown_j":{"awake_idle":2.5,"process":0.16,"rx":0.24,"sleep":0.11,"tx":2.4,"wake":0.02},"energy_scope":"endpoint-radio-and-processing-course-assumptions","events":[{"action":"SLEEP","case_id":"trace-b","contact_id":null,"cumulative_endpoint_energy_j":0,"end_s":0,"event_endpoint_energy_j":0,"event_id":"evt-0000","index":0,"observation":{"contact_open":false,"contact_remaining_s":0,"elapsed_s":0,"previous_action":null,"quality_band":0,"queue_size":0,"send_mode_active":false,"stable_steps":0,"steps_since_send":2,"urgent_due_in_s":null,"urgent_pending":false},"policy_sha256":"sha256:c00ed808d3a225abff99a19aee7426570c274b60b46231382be4407c78293718","quality_band":0,"start_s":0,"type":"POLICY_DECISION"},{"case_id":"trace-b","contact_id":null,"cumulative_endpoint_energy_j":0.01,"end_s":10,"event_endpoint_energy_j":0.01,"event_id":"evt-0001","index":1,"policy_sha256":"sha256:c00ed808d3a225abff99a19aee7426570c274b60b46231382be4407c78293718","quality_band":0,"start_s":0,"state":"SLEEP","type":"STATE_INTERVAL"},{"action":"SLEEP","case_id":"trace-b","contact_id":null,"cumulative_endpoint_energy_j":0.01,"end_s":10,"event_endpoint_energy_j":0,"event_id":"evt-0002","index":2,"observation":{"contact_open":false,"contact_remaining_s":0,"elapsed_s":10,"previous_action":"SLEEP","quality_band":0,"queue_size":0,"send_mode_active":false,"stable_steps":0,"steps_since_send":3,"urgent_due_in_s":null,"urgent_pending":false},"policy_sha256":"sha256:c00ed808d3a225abff99a19aee7426570c274b60b46231382be4407c78293718","quality_band":0,"start_s":10,"type":"POLICY_DECISION"},{"case_id":"trace-b","contact_id":null,"cumulative_endpoint_energy_j":0.02,"end_s":20,"event_endpoint_energy_j":0.01,"event_id":"evt-0003","index":3,"policy_sha256":"sha256:c00ed808d3a225abff99a19aee7426570c274b60b46231382be4407c78293718","quality_band":0,"start_s":10,"state":"SLEEP","type":"STATE_INTERVAL"},{"case_id":"trace-b","contact_id":null,"cumulative_endpoint_energy_j":0.02,"end_s":20,"event_endpoint_energy_j":0,"event_id":"evt-0004","index":4,"packet_ids":["normal-2"],"policy_sha256":"sha256:c00ed808d3a225abff99a19aee7426570c274b60b46231382be4407c78293718","quality_band":0,"start_s":20,"type":"PACKET_GENERATED"},{"action":"SLEEP","case_id":"trace-b","contact_id":null,"cumulative_endpoint_energy_j":0.02,"end_s":20,"event_endpoint_energy_j":0,"event_id":"evt-0005","index":5,"observation":{"contact_open":false,"contact_remaining_s":0,"elapsed_s":20,"previous_action":"SLEEP","quality_band":0,"queue_size":1,"send_mode_active":false,"stable_steps":0,"steps_since_send":4,"urgent_due_in_s":null,"urgent_pending":false},"policy_sha256":"sha256:c00ed808d3a225abff99a19aee7426570c274b60b46231382be4407c78293718","quality_band":0,"start_s":20,"type":"POLICY_DECISION"},{"case_id":"trace-b","contact_id":null,"cumulative_endpoint_energy_j":0.03,"end_s":30,"event_endpoint_energy_j":0.01,"event_id":"evt-0006","index":6,"policy_sha256":"sha256:c00ed808d3a225abff99a19aee7426570c274b60b46231382be4407c78293718","quality_band":0,"start_s":20,"state":"SLEEP","type":"STATE_INTERVAL"},{"action":"SLEEP","case_id":"trace-b","contact_id":null,"cumulative_endpoint_energy_j":0.03,"end_s":30,"event_endpoint_energy_j":0,"event_id":"evt-0007","index":7,"observation":{"contact_open":false,"contact_remaining_s":0,"elapsed_s":30,"previous_action":"SLEEP","quality_band":0,"queue_size":1,"send_mode_active":false,"stable_steps":0,"steps_since_send":5,"urgent_due_in_s":null,"urgent_pending":false},"policy_sha256":"sha256:c00ed808d3a225abff99a19aee7426570c274b60b46231382be4407c78293718","quality_band":0,"start_s":30,"type":"POLICY_DECISION"},{"case_id":"trace-b","contact_id":null,"cumulative_endpoint_energy_j":0.04,"end_s":40,"event_endpoint_energy_j":0.01,"event_id":"evt-0008","index":8,"policy_sha256":"sha256:c00ed808d3a225abff99a19aee7426570c274b60b46231382be4407c78293718","quality_band":0,"start_s":30,"state":"SLEEP","type":"STATE_INTERVAL"},{"case_id":"trace-b","contact_id":null,"cumulative_endpoint_energy_j":0.04,"end_s":40,"event_endpoint_energy_j":0,"event_id":"evt-0009","index":9,"packet_ids":["bulk-1"],"policy_sha256":"sha256:c00ed808d3a225abff99a19aee7426570c274b60b46231382be4407c78293718","quality_band":0,"start_s":40,"type":"PACKET_GENERATED"},{"action":"SLEEP","case_id":"trace-b","contact_id":null,"cumulative_endpoint_energy_j":0.04,"end_s":40,"event_endpoint_energy_j":0,"event_id":"evt-0010","index":10,"observation":{"contact_open":false,"contact_remaining_s":0,"elapsed_s":40,"previous_action":"SLEEP","quality_band":0,"queue_size":2,"send_mode_active":false,"stable_steps":0,"steps_since_send":6,"urgent_due_in_s":null,"urgent_pending":false},"policy_sha256":"sha256:c00ed808d3a225abff99a19aee7426570c274b60b46231382be4407c78293718","quality_band":0,"start_s":40,"type":"POLICY_DECISION"},{"case_id":"trace-b","contact_id":null,"cumulative_endpoint_energy_j":0.05,"end_s":50,"event_endpoint_energy_j":0.01,"event_id":"evt-0011","index":11,"policy_sha256":"sha256:c00ed808d3a225abff99a19aee7426570c274b60b46231382be4407c78293718","quality_band":0,"start_s":40,"state":"SLEEP","type":"STATE_INTERVAL"},{"action":"SLEEP","case_id":"trace-b","contact_id":null,"cumulative_endpoint_energy_j":0.05,"end_s":50,"event_endpoint_energy_j":0,"event_id":"evt-0012","index":12,"observation":{"contact_open":false,"contact_remaining_s":0,"elapsed_s":50,"previous_action":"SLEEP","quality_band":0,"queue_size":2,"send_mode_active":false,"stable_steps":0,"steps_since_send":7,"urgent_due_in_s":null,"urgent_pending":false},"policy_sha256":"sha256:c00ed808d3a225abff99a19aee7426570c274b60b46231382be4407c78293718","quality_band":0,"start_s":50,"type":"POLICY_DECISION"},{"case_id":"trace-b","contact_id":null,"cumulative_endpoint_energy_j":0.06,"end_s":60,"event_endpoint_energy_j":0.01,"event_id":"evt-0013","index":13,"policy_sha256":"sha256:c00ed808d3a225abff99a19aee7426570c274b60b46231382be4407c78293718","quality_band":0,"start_s":50,"state":"SLEEP","type":"STATE_INTERVAL"},{"action":"SLEEP","case_id":"trace-b","contact_id":null,"cumulative_endpoint_energy_j":0.06,"end_s":60,"event_endpoint_energy_j":0,"event_id":"evt-0014","index":14,"observation":{"contact_open":false,"contact_remaining_s":0,"elapsed_s":60,"previous_action":"SLEEP","quality_band":0,"queue_size":2,"send_mode_active":false,"stable_steps":0,"steps_since_send":8,"urgent_due_in_s":null,"urgent_pending":false},"policy_sha256":"sha256:c00ed808d3a225abff99a19aee7426570c274b60b46231382be4407c78293718","quality_band":0,"start_s":60,"type":"POLICY_DECISION"},{"case_id":"trace-b","contact_id":null,"cumulative_endpoint_energy_j":0.07,"end_s":70,"event_endpoint_energy_j":0.01,"event_id":"evt-0015","index":15,"policy_sha256":"sha256:c00ed808d3a225abff99a19aee7426570c274b60b46231382be4407c78293718","quality_band":0,"start_s":60,"state":"SLEEP","type":"STATE_INTERVAL"},{"case_id":"trace-b","contact_id":null,"cumulative_endpoint_energy_j":0.07,"end_s":70,"event_endpoint_energy_j":0,"event_id":"evt-0016","index":16,"packet_ids":["urgent-1"],"policy_sha256":"sha256:c00ed808d3a225abff99a19aee7426570c274b60b46231382be4407c78293718","quality_band":0,"start_s":70,"type":"PACKET_GENERATED"},{"action":"SLEEP","case_id":"trace-b","contact_id":null,"cumulative_endpoint_energy_j":0.07,"end_s":70,"event_endpoint_energy_j":0,"event_id":"evt-0017","index":17,"observation":{"contact_open":false,"contact_remaining_s":0,"elapsed_s":70,"previous_action":"SLEEP","quality_band":0,"queue_size":3,"send_mode_active":false,"stable_steps":0,"steps_since_send":9,"urgent_due_in_s":40,"urgent_pending":true},"policy_sha256":"sha256:c00ed808d3a225abff99a19aee7426570c274b60b46231382be4407c78293718","quality_band":0,"start_s":70,"type":"POLICY_DECISION"},{"case_id":"trace-b","contact_id":null,"cumulative_endpoint_energy_j":0.08,"end_s":80,"event_endpoint_energy_j":0.01,"event_id":"evt-0018","index":18,"policy_sha256":"sha256:c00ed808d3a225abff99a19aee7426570c274b60b46231382be4407c78293718","quality_band":0,"start_s":70,"state":"SLEEP","type":"STATE_INTERVAL"},{"action":"SLEEP","case_id":"trace-b","contact_id":null,"cumulative_endpoint_energy_j":0.08,"end_s":80,"event_endpoint_energy_j":0,"event_id":"evt-0019","index":19,"observation":{"contact_open":false,"contact_remaining_s":0,"elapsed_s":80,"previous_action":"SLEEP","quality_band":0,"queue_size":3,"send_mode_active":false,"stable_steps":0,"steps_since_send":10,"urgent_due_in_s":30,"urgent_pending":true},"policy_sha256":"sha256:c00ed808d3a225abff99a19aee7426570c274b60b46231382be4407c78293718","quality_band":0,"start_s":80,"type":"POLICY_DECISION"},{"case_id":"trace-b","contact_id":null,"cumulative_endpoint_energy_j":0.09,"end_s":90,"event_endpoint_energy_j":0.01,"event_id":"evt-0020","index":20,"policy_sha256":"sha256:c00ed808d3a225abff99a19aee7426570c274b60b46231382be4407c78293718","quality_band":0,"start_s":80,"state":"SLEEP","type":"STATE_INTERVAL"},{"action":"SLEEP","case_id":"trace-b","contact_id":null,"cumulative_endpoint_energy_j":0.09,"end_s":90,"event_endpoint_energy_j":0,"event_id":"evt-0021","index":21,"observation":{"contact_open":false,"contact_remaining_s":0,"elapsed_s":90,"previous_action":"SLEEP","quality_band":0,"queue_size":3,"send_mode_active":false,"stable_steps":0,"steps_since_send":11,"urgent_due_in_s":20,"urgent_pending":true},"policy_sha256":"sha256:c00ed808d3a225abff99a19aee7426570c274b60b46231382be4407c78293718","quality_band":0,"start_s":90,"type":"POLICY_DECISION"},{"case_id":"trace-b","contact_id":null,"cumulative_endpoint_energy_j":0.1,"end_s":100,"event_endpoint_energy_j":0.01,"event_id":"evt-0022","index":22,"policy_sha256":"sha256:c00ed808d3a225abff99a19aee7426570c274b60b46231382be4407c78293718","quality_band":0,"start_s":90,"state":"SLEEP","type":"STATE_INTERVAL"},{"action":"SEND_URGENT","case_id":"trace-b","contact_id":"contact-b","cumulative_endpoint